{
  "schema_version": "1.0.0",
  "event_id": "dab-publication-event-20260913T130128Z-23ea47d8",
  "run_id": "dab-publication-20260913T153600Z-71d3a6c2",
  "phase": "pages_verified",
  "edition_id": "dab-edition-2026-09-13",
  "observed_at": "2026-09-13T13:01:28Z",
  "baseline_main_sha": "f41cbbd277410c6fa0313a99957eff1afbe2e45b",
  "staged_tree_digest": "sha256:2f99e635cadb483c126cda4aee778e86e5702df004cdac0264cce3f0fd4a5b23",
  "generator_version": "1.0.0",
  "contract_version": "1.0.0",
  "checks": [
    {"check_id":"edition_validation","class":"deterministic","result":"pass","severity":"critical","evidence":"The final canonical edition, candidate pool, memory, generated views and watchlist pass active contracts and semantic validation."},
    {"check_id":"atomic_file_set","class":"deterministic","result":"pass","severity":"critical","evidence":"Publication PR #88 promoted the complete canonical, derived, asset, discovery, watchlist and release transaction from baseline f41cbbd277410c6fa0313a99957eff1afbe2e45b."},
    {"check_id":"live_reader_release","class":"deterministic","result":"pass","severity":"critical","evidence":"After rating-contract repair PR #89, final CI 34758518843 and Pages 34758518528 succeeded for SHA 23ea47d808e979117e42bd40f44d3b867565561f. Live reader routes, source/media links, feeds, controls and six exact image hashes pass."}
  ],
  "file_set": {
    "canonical_sources": ["_data/editions/2026-09-13.json","_records/editorial/candidates/2026-09-13.json","_data/story-memory/2026-09-13.json","_data/watchlist.json"],
    "assets": ["briefs/images/2026-09-13/01-agent-registry-containment.png","briefs/images/2026-09-13/02-agent-goal-pressure.png","briefs/images/2026-09-13/03-shopify-native-agents.png","briefs/images/2026-09-13/04-ai-running-routes.png","briefs/images/2026-09-13/05-portable-agent-skills.png","briefs/images/2026-09-13/06-agent-builder-learning-path.png"],
    "derived_outputs": ["briefs/2026-09-13.md","latest.md","index.md","archive.md","README.md","feed.json","feed.xml","daily-feed.xml","watchlist/index.md","watchlist/research/index.md"],
    "operational_records": ["_records/publication/2026-09-13/dab-publication-20260913T153600Z-71d3a6c2.validated.json","_records/qa/2026-09-13.json","_records/analytics/2026-09-13.json","_records/discovery/2026-09-13.json","_records/attempts/2026-09-13/dab-attempt-2026-09-13-publication-20260913T120000Z.json"]
  },
  "commit_sha": "23ea47d808e979117e42bd40f44d3b867565561f",
  "pages": {"run_id":34758518528,"conclusion":"success","verified_at":"2026-09-13T13:01:28Z"},
  "rollback_target_sha": "f41cbbd277410c6fa0313a99957eff1afbe2e45b",
  "supersedes_event_id": "dab-publication-event-20260913T161000Z-e6b7ed3f"
}
